id,group,name,code,group_index,icon_index,filename,viewBox,aliases,colors,schema_version,taxonomy_version,pack,labels.en,labels.ru,descriptions.en,descriptions.ru,categories,domains,keywords.en,keywords.ru,synonyms.en,synonyms.ru,negative_keywords.en,negative_keywords.ru,visual_kind,provenance.source_kind,provenance.source_url,provenance.source_ref,provenance.license_spdx,provenance.license_url,provenance.attribution,provenance.svg_sha256
agents_robot_agent_01-01,agents,robot_agent,01-01,1,1,agents_robot_agent_01-01.svg,0 0 512 512,robot_agent,#0b1fb3,2,1,core,Robot Agent,Робот-агент,Robot head representing an autonomous software agent.,"Голова робота, обозначающая автономного программного агента.",actor,ai-agents,robot|agent|actor|ai-agents,робот|агент|участник|ИИ-агенты,autonomous agent|software robot,автономный агент|программный робот,,,actor,project-authored,https://github.com/kroffske/excalidraw-js,assets/PROVENANCE.md#project-authored-bundled-assets,MIT,https://github.com/kroffske/excalidraw-js/blob/d28d62eaa0f4c6b0ceb06af216f91ed5f4545bd7/LICENSE,Project-authored by repository owner and maintainer kroffske.,bde6589f69dac1b60cbd60de635869c5997dfca4dfdce3671ba8373584a17131
agents_llm_chat_01-02,agents,llm_chat,01-02,1,2,agents_llm_chat_01-02.svg,0 0 512 512,llm_chat,#0b1fb3,2,1,core,LLM Chat,Чат с языковой моделью,Chat interface for a conversation with a large language model.,Интерфейс диалога с большой языковой моделью.,agent,ai-agents,llm|chat|agent|ai-agents,чат|с|языковой|моделью|агент|ИИ-агенты,AI conversation|language model chat,диалог с ИИ|переписка с языковой моделью,,,service,project-authored,https://github.com/kroffske/excalidraw-js,assets/PROVENANCE.md#project-authored-bundled-assets,MIT,https://github.com/kroffske/excalidraw-js/blob/d28d62eaa0f4c6b0ceb06af216f91ed5f4545bd7/LICENSE,Project-authored by repository owner and maintainer kroffske.,9879eba39844414e00293a627bb3fc5500724778f152e3629979f5ce77ade112
agents_agent_planner_01-03,agents,agent_planner,01-03,1,3,agents_agent_planner_01-03.svg,0 0 512 512,agent_planner,#8fb7df|#0b1fb3,2,1,core,Agent Planner,Планировщик агента,Agent paired with a checklist of planned steps.,Агент рядом с контрольным списком запланированных шагов.,agent,ai-agents,agent|planner|ai-agents,планировщик|агента|агент|ИИ-агенты,task planning agent|agent plan,агент-планировщик|план действий агента,,,service,project-authored,https://github.com/kroffske/excalidraw-js,assets/PROVENANCE.md#project-authored-bundled-assets,MIT,https://github.com/kroffske/excalidraw-js/blob/d28d62eaa0f4c6b0ceb06af216f91ed5f4545bd7/LICENSE,Project-authored by repository owner and maintainer kroffske.,8481f7b6f69d4dc90a75cca3c0eb3cd0e59b1e7c3961f7323b737e3406b5a287
agents_tool_call_01-04,agents,tool_call,01-04,1,4,agents_tool_call_01-04.svg,0 0 512 512,tool_call,#8fb7df|#0b1fb3,2,1,core,Tool Call,Вызов инструмента,Tool or wrench invoked by an agent action.,"Инструмент или ключ, вызываемый действием агента.",agent,ai-agents,tool|call|agent|ai-agents,вызов|инструмента|агент|ИИ-агенты,tool invocation|agent action,вызов функции|действие инструмента,,,event,project-authored,https://github.com/kroffske/excalidraw-js,assets/PROVENANCE.md#project-authored-bundled-assets,MIT,https://github.com/kroffske/excalidraw-js/blob/d28d62eaa0f4c6b0ceb06af216f91ed5f4545bd7/LICENSE,Project-authored by repository owner and maintainer kroffske.,c06d6d0615f895a61638e1371034588a87ee80840b62e4a355468d629cfd86b5
agents_function_router_01-05,agents,function_router,01-05,1,5,agents_function_router_01-05.svg,0 0 512 512,function_router,#8fb7df|#0b1fb3,2,1,core,Function Router,Маршрутизатор функций,Central router branching toward multiple callable functions.,Центральный маршрутизатор с ветвями к нескольким вызываемым функциям.,agent,ai-agents,function|router|agent|ai-agents,маршрутизатор|функций|агент|ИИ-агенты,function dispatch|tool router,диспетчер функций|маршрутизация инструментов,,,service,project-authored,https://github.com/kroffske/excalidraw-js,assets/PROVENANCE.md#project-authored-bundled-assets,MIT,https://github.com/kroffske/excalidraw-js/blob/d28d62eaa0f4c6b0ceb06af216f91ed5f4545bd7/LICENSE,Project-authored by repository owner and maintainer kroffske.,8609117679e1a3229a0dc8afb330d271e674f584ddd309ccf067568265ee557d
agents_rag_retriever_01-06,agents,rag_retriever,01-06,1,6,agents_rag_retriever_01-06.svg,0 0 512 512,rag_retriever,#8fb7df|#0b1fb3,2,1,core,RAG Retriever,Поиск контекста RAG,Documents being retrieved as context for a language model.,"Документы, извлекаемые как контекст для языковой модели.",agent,ai-agents,rag|retriever|agent|ai-agents,поиск|контекста|rag|агент|ИИ-агенты,context retrieval|document retriever,поиск документов|извлечение контекста,,,service,project-authored,https://github.com/kroffske/excalidraw-js,assets/PROVENANCE.md#project-authored-bundled-assets,MIT,https://github.com/kroffske/excalidraw-js/blob/d28d62eaa0f4c6b0ceb06af216f91ed5f4545bd7/LICENSE,Project-authored by repository owner and maintainer kroffske.,dbf4988b341ef669f7b984b8fbee906cae2cd858c7e6efb89f33b0a05b9f4b8d
agents_prompt_template_01-07,agents,prompt_template,01-07,1,7,agents_prompt_template_01-07.svg,0 0 512 512,prompt_template,#8fb7df|#0b1fb3,2,1,core,Prompt Template,Шаблон промпта,Prompt card containing reusable variable placeholders.,Карточка промпта с повторно используемыми переменными.,agent,ai-agents,prompt|template|agent|ai-agents,шаблон|промпта|агент|ИИ-агенты,prompt pattern|instruction template,шаблон инструкции|промпт с переменными,,,service,project-authored,https://github.com/kroffske/excalidraw-js,assets/PROVENANCE.md#project-authored-bundled-assets,MIT,https://github.com/kroffske/excalidraw-js/blob/d28d62eaa0f4c6b0ceb06af216f91ed5f4545bd7/LICENSE,Project-authored by repository owner and maintainer kroffske.,e7e2f6143ad97b2a285b23a9ba58a009dc4ace9d131e0674f39bd3d7da92fc22
agents_context_window_01-08,agents,context_window,01-08,1,8,agents_context_window_01-08.svg,0 0 512 512,context_window,#8fb7df|#0b1fb3,2,1,core,Context Window,Контекстное окно,Bounded stack of messages or documents available to a model.,"Ограниченная стопка сообщений или документов, доступных модели.",agent,ai-agents,context|window|agent|ai-agents,контекстное|окно|агент|ИИ-агенты,model context|token window,контекст модели|окно токенов,,,service,project-authored,https://github.com/kroffske/excalidraw-js,assets/PROVENANCE.md#project-authored-bundled-assets,MIT,https://github.com/kroffske/excalidraw-js/blob/d28d62eaa0f4c6b0ceb06af216f91ed5f4545bd7/LICENSE,Project-authored by repository owner and maintainer kroffske.,88c992cd6258839583b3df33eaae2bb16e4cb8a1ee68fd27d9cd7279caa6fa54
agents_multi_agent_orchestrator_01-09,agents,multi_agent_orchestrator,01-09,1,9,agents_multi_agent_orchestrator_01-09.svg,0 0 512 512,multi_agent_orchestrator,#8fb7df|#0b1fb3,2,1,core,Multi Agent Orchestrator,Оркестратор нескольких агентов,Central coordinator connected to several collaborating agents.,"Центральный координатор, соединённый с несколькими совместно работающими агентами.",agent,ai-agents,multi|agent|orchestrator|ai-agents,оркестратор|нескольких|агентов|агент|ИИ-агенты,agent coordinator|agent swarm controller,координатор агентов|управление группой агентов,,,service,project-authored,https://github.com/kroffske/excalidraw-js,assets/PROVENANCE.md#project-authored-bundled-assets,MIT,https://github.com/kroffske/excalidraw-js/blob/d28d62eaa0f4c6b0ceb06af216f91ed5f4545bd7/LICENSE,Project-authored by repository owner and maintainer kroffske.,6827e3dafa94600c33b39aa12f308fc1eec7ed176513e7b9b04fa8b251f788c2
agents_agent_debate_01-10,agents,agent_debate,01-10,1,10,agents_agent_debate_01-10.svg,0 0 512 512,agent_debate,#0b1fb3,2,1,core,Agent Debate,Дискуссия агентов,Multiple agents exchanging competing arguments or proposals.,Несколько агентов обмениваются конкурирующими аргументами или предложениями.,agent,ai-agents,agent|debate|ai-agents,дискуссия|агентов|агент|ИИ-агенты,multi-agent discussion|agent deliberation,обсуждение агентов|совещание агентов,,,service,project-authored,https://github.com/kroffske/excalidraw-js,assets/PROVENANCE.md#project-authored-bundled-assets,MIT,https://github.com/kroffske/excalidraw-js/blob/d28d62eaa0f4c6b0ceb06af216f91ed5f4545bd7/LICENSE,Project-authored by repository owner and maintainer kroffske.,81da300204f4a373a96c3fce5325553500b0aa6858f38045d3138c435ce014c9
agents_monitoring_dashboard_01-11,agents,monitoring_dashboard,01-11,1,11,agents_monitoring_dashboard_01-11.svg,0 0 512 512,monitoring_dashboard,#8fb7df|#0b1fb3,2,1,core,Monitoring Dashboard,Панель мониторинга,Dashboard screen combining several model and system metrics.,"Экран панели, объединяющий несколько метрик модели и системы.",observability,operations|machine-learning,monitoring|dashboard|observability|operations|machine-learning,панель|мониторинга|наблюдаемость|операции|машинное обучение,metrics dashboard|system monitoring,панель метрик|мониторинг системы,,,chart,project-authored,https://github.com/kroffske/excalidraw-js,assets/PROVENANCE.md#project-authored-bundled-assets,MIT,https://github.com/kroffske/excalidraw-js/blob/d28d62eaa0f4c6b0ceb06af216f91ed5f4545bd7/LICENSE,Project-authored by repository owner and maintainer kroffske.,49ec2a0d1e6f4a6462bb863f8f86d2efaf765399592628f3710af81242c64624
agents_model_deployment_01-12,agents,model_deployment,01-12,1,12,agents_model_deployment_01-12.svg,0 0 512 512,model_deployment,#8fb7df|#0b1fb3,2,1,core,Model Deployment,Развёртывание модели,Model or chip launched into a serving environment.,"Модель или чип, запускаемый в среду обслуживания.",model,machine-learning,model|deployment|machine-learning,развёртывание|модели|модель|машинное обучение,model release|serving deployment,публикация модели|запуск модели в продакшен,,,data,project-authored,https://github.com/kroffske/excalidraw-js,assets/PROVENANCE.md#project-authored-bundled-assets,MIT,https://github.com/kroffske/excalidraw-js/blob/d28d62eaa0f4c6b0ceb06af216f91ed5f4545bd7/LICENSE,Project-authored by repository owner and maintainer kroffske.,cbf8194f1ee9c5008880df96edda96a210e2c3852ae3de81b845eb36c10dca6e
agents_rollback_version_01-13,agents,rollback_version,01-13,1,13,agents_rollback_version_01-13.svg,0 0 512 512,rollback_version,#8fb7df|#0b1fb3,2,1,core,Rollback Version,Откат версии,Backward arrow returning software or a model to an earlier version.,"Стрелка назад, возвращающая программу или модель к предыдущей версии.",agent,ai-agents,rollback|version|agent|ai-agents,откат|версии|агент|ИИ-агенты,version revert|restore previous version,возврат версии|восстановление предыдущей версии,,,service,project-authored,https://github.com/kroffske/excalidraw-js,assets/PROVENANCE.md#project-authored-bundled-assets,MIT,https://github.com/kroffske/excalidraw-js/blob/d28d62eaa0f4c6b0ceb06af216f91ed5f4545bd7/LICENSE,Project-authored by repository owner and maintainer kroffske.,d1bd65f7c22f0a94aebfa403e5de3e8802f3a2b37585eb1da5fc87678abfa84c
agents_confusion_matrix_01-14,agents,confusion_matrix,01-14,1,14,agents_confusion_matrix_01-14.svg,0 0 512 512,confusion_matrix,#8fb7df|#0b1fb3,2,1,core,Confusion Matrix,Матрица ошибок,Two-by-two classification matrix of predicted and actual outcomes.,Матрица классификации два на два для предсказанных и фактических исходов.,evaluation,machine-learning,confusion|matrix|evaluation|machine-learning,матрица|ошибок|оценка|машинное обучение,classification matrix|prediction error table,матрица классификации|таблица ошибок предсказания,,,chart,project-authored,https://github.com/kroffske/excalidraw-js,assets/PROVENANCE.md#project-authored-bundled-assets,MIT,https://github.com/kroffske/excalidraw-js/blob/d28d62eaa0f4c6b0ceb06af216f91ed5f4545bd7/LICENSE,Project-authored by repository owner and maintainer kroffske.,1d163276b4d2731d4cde0119be3f1d6f8fb609c39b6d93bb39c7a0cc99b0b3e2
agents_roc_curve_01-15,agents,roc_curve,01-15,1,15,agents_roc_curve_01-15.svg,0 0 512 512,roc_curve,#8fb7df|#0b1fb3,2,1,core,ROC Curve,ROC-кривая,Receiver operating characteristic curve plotted against a diagonal baseline.,"ROC-кривая, построенная относительно диагональной базовой линии.",evaluation,machine-learning,roc|curve|evaluation|machine-learning,roc|кривая|оценка|машинное обучение,classifier ROC|true false positive curve,график качества классификатора|кривая истинных и ложных срабатываний,,,chart,project-authored,https://github.com/kroffske/excalidraw-js,assets/PROVENANCE.md#project-authored-bundled-assets,MIT,https://github.com/kroffske/excalidraw-js/blob/d28d62eaa0f4c6b0ceb06af216f91ed5f4545bd7/LICENSE,Project-authored by repository owner and maintainer kroffske.,af1acbc6cd83d94a53421e962c0fda9073dfd69f8addc0a9e3760fa7a9b39fa6
agents_precision_recall_balance_01-16,agents,precision_recall_balance,01-16,1,16,agents_precision_recall_balance_01-16.svg,0 0 512 512,precision_recall_balance,#8fb7df|#0b1fb3,2,1,core,Precision Recall Balance,Баланс точности и полноты,Balance scale comparing precision with recall.,"Весы, сравнивающие точность с полнотой.",evaluation,machine-learning,precision|recall|balance|evaluation|machine-learning,баланс|точности|и|полноты|оценка|машинное обучение,precision recall tradeoff|classification balance,компромисс точности и полноты|баланс классификации,,,chart,project-authored,https://github.com/kroffske/excalidraw-js,assets/PROVENANCE.md#project-authored-bundled-assets,MIT,https://github.com/kroffske/excalidraw-js/blob/d28d62eaa0f4c6b0ceb06af216f91ed5f4545bd7/LICENSE,Project-authored by repository owner and maintainer kroffske.,fde2c6f171284839b28378e9eb5ee5ad47ed765a4947800a3fcccd8ad68dc31e
agents_model_training_01-17,agents,model_training,01-17,1,17,agents_model_training_01-17.svg,0 0 512 512,model_training,#0b1fb3,2,1,core,Model Training,Обучение модели,Model learning process driven by data and optimization.,Процесс обучения модели на данных с помощью оптимизации.,evaluation,machine-learning,model|training|evaluation|machine-learning,обучение|модели|оценка|машинное обучение,machine learning training|fit model,обучение машинной модели|подгонка модели,,,chart,project-authored,https://github.com/kroffske/excalidraw-js,assets/PROVENANCE.md#project-authored-bundled-assets,MIT,https://github.com/kroffske/excalidraw-js/blob/d28d62eaa0f4c6b0ceb06af216f91ed5f4545bd7/LICENSE,Project-authored by repository owner and maintainer kroffske.,9a8bb514b6dc29bf4b9776ff96ba995816dd4150164dbeb5f376eb1ba705dfb9
agents_model_validation_01-18,agents,model_validation,01-18,1,18,agents_model_validation_01-18.svg,0 0 512 512,model_validation,#0b1fb3,2,1,core,Model Validation,Валидация модели,Model checked against acceptance or evaluation criteria.,"Модель, проверяемая по критериям приёмки или оценки.",evaluation,machine-learning,model|validation|evaluation|machine-learning,валидация|модели|оценка|машинное обучение,model evaluation|validation check,оценка модели|проверка модели,,,chart,project-authored,https://github.com/kroffske/excalidraw-js,assets/PROVENANCE.md#project-authored-bundled-assets,MIT,https://github.com/kroffske/excalidraw-js/blob/d28d62eaa0f4c6b0ceb06af216f91ed5f4545bd7/LICENSE,Project-authored by repository owner and maintainer kroffske.,d20a326a142ce1e1eff6fc9b175cf8fc4559feed49b30beca466a9560df5f041
agents_experiment_flask_01-19,agents,experiment_flask,01-19,1,19,agents_experiment_flask_01-19.svg,0 0 512 512,experiment_flask,#0b1fb3,2,1,core,Experiment Flask,Колба эксперимента,Laboratory flask representing a controlled experiment.,"Лабораторная колба, обозначающая контролируемый эксперимент.",evaluation,machine-learning,experiment|flask|evaluation|machine-learning,колба|эксперимента|оценка|машинное обучение,experiment trial|research test,экспериментальный запуск|исследовательский тест,,,chart,project-authored,https://github.com/kroffske/excalidraw-js,assets/PROVENANCE.md#project-authored-bundled-assets,MIT,https://github.com/kroffske/excalidraw-js/blob/d28d62eaa0f4c6b0ceb06af216f91ed5f4545bd7/LICENSE,Project-authored by repository owner and maintainer kroffske.,2c286369ecff88019968fb6c40cfa3dab9472590ba67438e54769f69ddfe15c8
agents_hypothesis_lightbulb_01-20,agents,hypothesis_lightbulb,01-20,1,20,agents_hypothesis_lightbulb_01-20.svg,0 0 512 512,hypothesis_lightbulb,#0b1fb3,2,1,core,Hypothesis Lightbulb,Лампочка гипотезы,Lightbulb representing a proposed hypothesis or new idea.,"Лампочка, обозначающая предложенную гипотезу или новую идею.",agent,ai-agents,hypothesis|lightbulb|agent|ai-agents,лампочка|гипотезы|агент|ИИ-агенты,research hypothesis|testable idea,исследовательская гипотеза|проверяемая идея,,,service,project-authored,https://github.com/kroffske/excalidraw-js,assets/PROVENANCE.md#project-authored-bundled-assets,MIT,https://github.com/kroffske/excalidraw-js/blob/d28d62eaa0f4c6b0ceb06af216f91ed5f4545bd7/LICENSE,Project-authored by repository owner and maintainer kroffske.,e903f65d35676ef1dc79fd714d202f160b230959392e027ef4a7eb0eb8eb1837
agents_optimization_sliders_01-21,agents,optimization_sliders,01-21,1,21,agents_optimization_sliders_01-21.svg,0 0 512 512,optimization_sliders,#0b1fb3,2,1,core,Optimization Sliders,Ползунки оптимизации,Adjustable sliders representing parameter optimization.,"Регулируемые ползунки, обозначающие оптимизацию параметров.",agent,ai-agents,optimization|sliders|agent|ai-agents,ползунки|оптимизации|агент|ИИ-агенты,parameter tuning|optimization controls,настройка параметров|управление оптимизацией,,,service,project-authored,https://github.com/kroffske/excalidraw-js,assets/PROVENANCE.md#project-authored-bundled-assets,MIT,https://github.com/kroffske/excalidraw-js/blob/d28d62eaa0f4c6b0ceb06af216f91ed5f4545bd7/LICENSE,Project-authored by repository owner and maintainer kroffske.,939139a244bb6243c8cefa562adc53aca5d5982e8236fe289cd93e271866477b
agents_signal_quality_magnifier_01-22,agents,signal_quality_magnifier,01-22,1,22,agents_signal_quality_magnifier_01-22.svg,0 0 512 512,signal_quality_magnifier,#0b1fb3,2,1,core,Signal Quality Magnifier,Проверка качества сигнала,Magnifying glass inspecting the quality of a measured signal.,"Лупа, исследующая качество измеренного сигнала.",observability,operations|machine-learning,signal|quality|magnifier|observability|operations|machine-learning,проверка|качества|сигнала|наблюдаемость|операции|машинное обучение,signal inspection|quality analysis,проверка сигнала|анализ качества,,,event,project-authored,https://github.com/kroffske/excalidraw-js,assets/PROVENANCE.md#project-authored-bundled-assets,MIT,https://github.com/kroffske/excalidraw-js/blob/d28d62eaa0f4c6b0ceb06af216f91ed5f4545bd7/LICENSE,Project-authored by repository owner and maintainer kroffske.,040d5075276552fd678f186a072eff50a9a27b5db9d9f60e8b3269ef32060857
agents_model_refresh_01-23,agents,model_refresh,01-23,1,23,agents_model_refresh_01-23.svg,0 0 512 512,model_refresh,#0b1fb3,2,1,core,Model Refresh,Обновление модели,Circular refresh action updating a deployed or stored model.,Круговое действие обновления развёрнутой или сохранённой модели.,model,machine-learning,model|refresh|machine-learning,обновление|модели|модель|машинное обучение,model update|retrain refresh,обновление модели|переобучение модели,,,data,project-authored,https://github.com/kroffske/excalidraw-js,assets/PROVENANCE.md#project-authored-bundled-assets,MIT,https://github.com/kroffske/excalidraw-js/blob/d28d62eaa0f4c6b0ceb06af216f91ed5f4545bd7/LICENSE,Project-authored by repository owner and maintainer kroffske.,aa0aa1d70d47f1e77da02b5be89e7a8f242368e0a3536ebf418937f2c60f6bd4
agents_guardrails_01-24,agents,guardrails,01-24,1,24,agents_guardrails_01-24.svg,0 0 512 512,guardrails,#8fb7df|#0b1fb3,2,1,core,Guardrails,Защитные ограничения,Protective rails constraining an AI response or action.,"Защитные ограждения, ограничивающие ответ или действие ИИ.",security,security|ai-agents,guardrails|security|ai-agents,защитные|ограничения|безопасность|ИИ-агенты,AI safety constraints|response boundaries,ограничения безопасности ИИ|границы ответа,,,control,project-authored,https://github.com/kroffske/excalidraw-js,assets/PROVENANCE.md#project-authored-bundled-assets,MIT,https://github.com/kroffske/excalidraw-js/blob/d28d62eaa0f4c6b0ceb06af216f91ed5f4545bd7/LICENSE,Project-authored by repository owner and maintainer kroffske.,8636e697d1e7546c7562416a8477074e39d5b617f267537faaa0db086b9e619d
agents_human_review_01-25,agents,human_review,01-25,1,25,agents_human_review_01-25.svg,0 0 512 512,human_review,#0b1fb3,2,1,core,Human Review,Проверка человеком,Person checking and approving an automated result.,Человек проверяет и утверждает автоматический результат.,actor,ai-agents,human|review|actor|ai-agents,проверка|человеком|участник|ИИ-агенты,human approval|manual verification,ручное согласование|проверка оператором,,,actor,project-authored,https://github.com/kroffske/excalidraw-js,assets/PROVENANCE.md#project-authored-bundled-assets,MIT,https://github.com/kroffske/excalidraw-js/blob/d28d62eaa0f4c6b0ceb06af216f91ed5f4545bd7/LICENSE,Project-authored by repository owner and maintainer kroffske.,f0c0999d8400c8362f923837ae078cf420a6179b2e78b0410701258b6c739d54
agents_compliance_scale_01-26,agents,compliance_scale,01-26,1,26,agents_compliance_scale_01-26.svg,0 0 512 512,compliance_scale,#0b1fb3,2,1,core,Compliance Scale,Весы соответствия,Balance scale representing policy or regulatory compliance.,"Весы, обозначающие соответствие политике или требованиям регулятора.",security,security|ai-agents,compliance|scale|security|ai-agents,весы|соответствия|безопасность|ИИ-агенты,policy compliance|regulatory check,соответствие политике|регуляторная проверка,,,control,project-authored,https://github.com/kroffske/excalidraw-js,assets/PROVENANCE.md#project-authored-bundled-assets,MIT,https://github.com/kroffske/excalidraw-js/blob/d28d62eaa0f4c6b0ceb06af216f91ed5f4545bd7/LICENSE,Project-authored by repository owner and maintainer kroffske.,c949b04737c68e466015ccfc7a45441927b849a4a303d891f669ec95a6638089
