id,group,name,code,group_index,icon_index,filename,viewBox,aliases,colors,schema_version,taxonomy_version,pack,labels.en,labels.ru,descriptions.en,descriptions.ru,categories,domains,keywords.en,keywords.ru,synonyms.en,synonyms.ru,negative_keywords.en,negative_keywords.ru,visual_kind,provenance.source_kind,provenance.source_url,provenance.source_ref,provenance.license_spdx,provenance.license_url,provenance.attribution,provenance.svg_sha256
data_model_drift_alarm_02-20,data,model_drift_alarm,02-20,2,20,data_model_drift_alarm_02-20.svg,0 0 512 512,model_drift_alarm,#8fb7df|#d41217|#0b1fb3,2,1,core,Model Drift Alarm,Сигнал дрейфа модели,Diverging distributions paired with an alert for model drift.,Расходящиеся распределения с предупреждением о дрейфе модели.,observability,operations|machine-learning,model|drift|alarm|observability|operations|machine-learning,сигнал|дрейфа|модели|наблюдаемость|операции|машинное обучение,drift detection|model change alert,обнаружение дрейфа|предупреждение об изменении модели,,,event,project-authored,https://github.com/kroffske/excalidraw-js,assets/PROVENANCE.md#project-authored-bundled-assets,MIT,https://github.com/kroffske/excalidraw-js/blob/d28d62eaa0f4c6b0ceb06af216f91ed5f4545bd7/LICENSE,Project-authored by repository owner and maintainer kroffske.,093a99f284553802c63a543748c53f5c43b90f8fde5fd7116f340e339e132b99
data_embedding_vector_02-21,data,embedding_vector,02-21,2,21,data_embedding_vector_02-21.svg,0 0 512 512,embedding_vector,#0b1fb3,2,1,core,Embedding Vector,Вектор эмбеддинга,Ordered numeric vector representing an embedded item.,"Упорядоченный числовой вектор, представляющий объект в пространстве признаков.",model,machine-learning,embedding|vector|model|machine-learning,вектор|эмбеддинга|модель|машинное обучение,vector embedding|semantic vector,векторное представление|семантический вектор,,,data,project-authored,https://github.com/kroffske/excalidraw-js,assets/PROVENANCE.md#project-authored-bundled-assets,MIT,https://github.com/kroffske/excalidraw-js/blob/d28d62eaa0f4c6b0ceb06af216f91ed5f4545bd7/LICENSE,Project-authored by repository owner and maintainer kroffske.,a9b0deaf0a0d56a478681ea21856072eb9c0a742a038952059838245d5a11914
data_vector_database_02-22,data,vector_database,02-22,2,22,data_vector_database_02-22.svg,0 0 512 512,vector_database,#0b1fb3,2,1,core,Vector Database,Векторная база данных,Database cylinder containing stored numeric vectors.,Цилиндр базы данных с сохранёнными числовыми векторами.,model,machine-learning,vector|database|model|machine-learning,векторная|база|данных|модель|машинное обучение,vector store|embedding database,векторное хранилище|база эмбеддингов,,,data,project-authored,https://github.com/kroffske/excalidraw-js,assets/PROVENANCE.md#project-authored-bundled-assets,MIT,https://github.com/kroffske/excalidraw-js/blob/d28d62eaa0f4c6b0ceb06af216f91ed5f4545bd7/LICENSE,Project-authored by repository owner and maintainer kroffske.,ebedcd34c83b18c761639eac0b92a92da549a2cca6721782d1f75e8818cf921b
data_knowledge_graph_02-23,data,knowledge_graph,02-23,2,23,data_knowledge_graph_02-23.svg,0 0 512 512,knowledge_graph,#0b1fb3,2,1,core,Knowledge Graph,Граф знаний,Connected entities representing facts in a knowledge graph.,"Связанные сущности, представляющие факты в графе знаний.",data,data,knowledge|graph|data,граф|знаний|данные,entity relationship graph|fact graph,граф сущностей|граф фактов,,,chart,project-authored,https://github.com/kroffske/excalidraw-js,assets/PROVENANCE.md#project-authored-bundled-assets,MIT,https://github.com/kroffske/excalidraw-js/blob/d28d62eaa0f4c6b0ceb06af216f91ed5f4545bd7/LICENSE,Project-authored by repository owner and maintainer kroffske.,05e708f124624378ce249a8584cb2dd4b9c0f1e3770d215b064208c78446edd9
data_semantic_graph_02-24,data,semantic_graph,02-24,2,24,data_semantic_graph_02-24.svg,0 0 512 512,semantic_graph,#0b1fb3,2,1,core,Semantic Graph,Семантический граф,Connected concepts and relations in a semantic graph.,Связанные понятия и отношения в семантическом графе.,data,data,semantic|graph|data,семантический|граф|данные,concept graph|meaning network,граф понятий|сеть смыслов,,,chart,project-authored,https://github.com/kroffske/excalidraw-js,assets/PROVENANCE.md#project-authored-bundled-assets,MIT,https://github.com/kroffske/excalidraw-js/blob/d28d62eaa0f4c6b0ceb06af216f91ed5f4545bd7/LICENSE,Project-authored by repository owner and maintainer kroffske.,dce62ffa4b06559a4eebaa7d1b7f3e3d42bf97f90d3bb607a61441bb6ed3ef5c
data_memory_database_02-25,data,memory_database,02-25,2,25,data_memory_database_02-25.svg,0 0 512 512,memory_database,#0b1fb3,2,1,core,Memory Database,База данных памяти,Persistent database used as application or agent memory.,"Постоянная база данных, используемая как память приложения или агента.",data,data,memory|database|data,база|данных|памяти|данные,memory store|persistent context,хранилище памяти|постоянный контекст,,,data,project-authored,https://github.com/kroffske/excalidraw-js,assets/PROVENANCE.md#project-authored-bundled-assets,MIT,https://github.com/kroffske/excalidraw-js/blob/d28d62eaa0f4c6b0ceb06af216f91ed5f4545bd7/LICENSE,Project-authored by repository owner and maintainer kroffske.,83c5c299be5d86865fe3c90ed8b9411a92640db52ca5c5cd132aab0d9f6fa0db
data_filter_funnel_02-26,data,filter_funnel,02-26,2,26,data_filter_funnel_02-26.svg,0 0 512 512,filter_funnel,#0b1fb3,2,1,core,Filter Funnel,Воронка фильтра,Funnel narrowing a larger data set into selected records.,Воронка сужает большой набор данных до выбранных записей.,agent,ai-agents,filter|funnel|agent|ai-agents,воронка|фильтра|агент|ИИ-агенты,data filter|record selection,фильтр данных|отбор записей,,,service,project-authored,https://github.com/kroffske/excalidraw-js,assets/PROVENANCE.md#project-authored-bundled-assets,MIT,https://github.com/kroffske/excalidraw-js/blob/d28d62eaa0f4c6b0ceb06af216f91ed5f4545bd7/LICENSE,Project-authored by repository owner and maintainer kroffske.,5ccf6cb9d150510596fda24389548df07c24980fa8a7e329aa36c802c6f632db
data_aggregation_puzzle_02-27,data,aggregation_puzzle,02-27,2,27,data_aggregation_puzzle_02-27.svg,0 0 512 512,aggregation_puzzle,#0b1fb3,2,1,core,Aggregation Puzzle,Агрегация данных,Separate data pieces combined into an aggregated whole.,Отдельные части данных объединяются в агрегированное целое.,agent,ai-agents,aggregation|puzzle|agent|ai-agents,агрегация|данных|агент|ИИ-агенты,data aggregation|combine records,агрегация данных|объединение записей,,,service,project-authored,https://github.com/kroffske/excalidraw-js,assets/PROVENANCE.md#project-authored-bundled-assets,MIT,https://github.com/kroffske/excalidraw-js/blob/d28d62eaa0f4c6b0ceb06af216f91ed5f4545bd7/LICENSE,Project-authored by repository owner and maintainer kroffske.,16d09d1ed9f408f9aafa7eaa8660fdb2f51e475f03ca8a06a4e20ce5e04e775e
data_news_document_02-28,data,news_document,02-28,2,28,data_news_document_02-28.svg,0 0 512 512,news_document,#0b1fb3,2,1,core,News Document,Новостной документ,Document page containing a news or information item.,Страница документа с новостью или информационным материалом.,data,data,news|document|data,новостной|документ|данные,news article|information document,новостная статья|информационный документ,,,data,project-authored,https://github.com/kroffske/excalidraw-js,assets/PROVENANCE.md#project-authored-bundled-assets,MIT,https://github.com/kroffske/excalidraw-js/blob/d28d62eaa0f4c6b0ceb06af216f91ed5f4545bd7/LICENSE,Project-authored by repository owner and maintainer kroffske.,85981882ca549d58a9e29419c56bd572d41660e9eb37ebf138fec317fd6f588d
data_calendar_event_02-29,data,calendar_event,02-29,2,29,data_calendar_event_02-29.svg,0 0 512 512,calendar_event,#0b1fb3,2,1,core,Calendar Event,Событие календаря,Calendar page marking a scheduled event or date.,Страница календаря с отмеченным событием или датой.,data,data,calendar|event|data,событие|календаря|данные,scheduled event|date marker,запланированное событие|отметка даты,,,data,project-authored,https://github.com/kroffske/excalidraw-js,assets/PROVENANCE.md#project-authored-bundled-assets,MIT,https://github.com/kroffske/excalidraw-js/blob/d28d62eaa0f4c6b0ceb06af216f91ed5f4545bd7/LICENSE,Project-authored by repository owner and maintainer kroffske.,c6b3d793c8509e169b34f757b45a24cb1ddad3f0bbcdf075f5098ef376d5b1d6
data_historical_database_02-30,data,historical_database,02-30,2,30,data_historical_database_02-30.svg,0 0 512 512,historical_database,#0b1fb3,2,1,core,Historical Database,Историческая база данных,Database paired with time history or archived records.,База данных с временной историей или архивными записями.,agent,ai-agents,historical|database|agent|ai-agents,историческая|база|данных|агент|ИИ-агенты,history store|archive database,хранилище истории|архивная база,,,service,project-authored,https://github.com/kroffske/excalidraw-js,assets/PROVENANCE.md#project-authored-bundled-assets,MIT,https://github.com/kroffske/excalidraw-js/blob/d28d62eaa0f4c6b0ceb06af216f91ed5f4545bd7/LICENSE,Project-authored by repository owner and maintainer kroffske.,88421df93e8a553c2fd7a79435b2d87d5d5c19f07b27c921863c68e98873fb5b
data_heartbeat_signal_02-31,data,heartbeat_signal,02-31,2,31,data_heartbeat_signal_02-31.svg,0 0 512 512,heartbeat_signal,#0b1fb3,2,1,core,Heartbeat Signal,Сигнал сердцебиения,Pulse line indicating system health or liveness.,"Линия пульса, показывающая работоспособность или доступность системы.",observability,operations|machine-learning,heartbeat|signal|observability|operations|machine-learning,сигнал|сердцебиения|наблюдаемость|операции|машинное обучение,health signal|liveness pulse,сигнал здоровья|импульс доступности,,,event,project-authored,https://github.com/kroffske/excalidraw-js,assets/PROVENANCE.md#project-authored-bundled-assets,MIT,https://github.com/kroffske/excalidraw-js/blob/d28d62eaa0f4c6b0ceb06af216f91ed5f4545bd7/LICENSE,Project-authored by repository owner and maintainer kroffske.,537bedf7de9340fee13be80a281564ab5bf2adda6cb611053e81c0afb72e8382
