id,group,name,code,group_index,icon_index,filename,viewBox,aliases,colors,schema_version,taxonomy_version,pack,labels.en,labels.ru,descriptions.en,descriptions.ru,categories,domains,keywords.en,keywords.ru,synonyms.en,synonyms.ru,negative_keywords.en,negative_keywords.ru,visual_kind,provenance.source_kind,provenance.source_url,provenance.source_ref,provenance.license_spdx,provenance.license_url,provenance.attribution,provenance.svg_sha256
agents_audit_log_01-27,agents,audit_log,01-27,1,27,agents_audit_log_01-27.svg,0 0 512 512,audit_log,#0b1fb3,2,1,core,Audit Log,Журнал аудита,Ordered record of actions available for audit and traceability.,Упорядоченная запись действий для аудита и отслеживания.,observability,operations|machine-learning,audit|log|observability|operations|machine-learning,журнал|аудита|наблюдаемость|операции|машинное обучение,activity history|audit trail,история действий|аудиторский след,,,service,project-authored,https://github.com/kroffske/excalidraw-js,assets/PROVENANCE.md#project-authored-bundled-assets,MIT,https://github.com/kroffske/excalidraw-js/blob/d28d62eaa0f4c6b0ceb06af216f91ed5f4545bd7/LICENSE,Project-authored by repository owner and maintainer kroffske.,b59123aa5c20adb06171dc3ddbda46522ccab7981727a13d0723ec9ea7235957
agents_kill_switch_01-28,agents,kill_switch,01-28,1,28,agents_kill_switch_01-28.svg,0 0 512 512,kill_switch,#0b1fb3,2,1,core,Kill Switch,Аварийный выключатель,Emergency control that immediately stops an automated system.,"Аварийный элемент управления, немедленно останавливающий автоматическую систему.",security,security|ai-agents,kill|switch|security|ai-agents,аварийный|выключатель|безопасность|ИИ-агенты,emergency stop|shutdown control,аварийная остановка|экстренное отключение,,,control,project-authored,https://github.com/kroffske/excalidraw-js,assets/PROVENANCE.md#project-authored-bundled-assets,MIT,https://github.com/kroffske/excalidraw-js/blob/d28d62eaa0f4c6b0ceb06af216f91ed5f4545bd7/LICENSE,Project-authored by repository owner and maintainer kroffske.,47a9d368157b151a51d344015d813d9c8d0f7ad9361e82daec898bca0cd4d0a4
agents_pii_masking_01-29,agents,pii_masking,01-29,1,29,agents_pii_masking_01-29.svg,0 0 512 512,pii_masking,#8fb7df|#0b1fb3|#1a245f,2,1,core,PII Masking,Маскирование персональных данных,Identity card or personal fields obscured to protect private data.,Удостоверение или персональные поля скрыты для защиты личных данных.,security,security|ai-agents,pii|masking|security|ai-agents,маскирование|персональных|данных|безопасность|ИИ-агенты,personal data redaction|privacy masking,скрытие персональных данных|обезличивание,,,control,project-authored,https://github.com/kroffske/excalidraw-js,assets/PROVENANCE.md#project-authored-bundled-assets,MIT,https://github.com/kroffske/excalidraw-js/blob/d28d62eaa0f4c6b0ceb06af216f91ed5f4545bd7/LICENSE,Project-authored by repository owner and maintainer kroffske.,50029b9dfdc6217849c70c6c57dd9e72ee0d4a8e6d13e19d7a740d8039d327f0
agents_sandbox_executor_01-30,agents,sandbox_executor,01-30,1,30,agents_sandbox_executor_01-30.svg,0 0 512 512,sandbox_executor,#8fb7df|#0b1fb3,2,1,core,Sandbox Executor,Исполнитель в песочнице,Code or command executing inside an isolated protected container.,Код или команда выполняется внутри изолированного защищённого контейнера.,security,security|ai-agents,sandbox|executor|security|ai-agents,исполнитель|в|песочнице|безопасность|ИИ-агенты,isolated execution|secure code runner,изолированное выполнение|защищённый запуск кода,,,control,project-authored,https://github.com/kroffske/excalidraw-js,assets/PROVENANCE.md#project-authored-bundled-assets,MIT,https://github.com/kroffske/excalidraw-js/blob/d28d62eaa0f4c6b0ceb06af216f91ed5f4545bd7/LICENSE,Project-authored by repository owner and maintainer kroffske.,a4cd82409ab26afd83aab8517ebed584cc4aa93747374d842936113fe426bbc4
agents_confidence_meter_01-31,agents,confidence_meter,01-31,1,31,agents_confidence_meter_01-31.svg,0 0 512 512,confidence_meter,#0b1fb3,2,1,core,Confidence Meter,Индикатор уверенности,Gauge displaying a model or prediction confidence level.,"Шкала, показывающая уровень уверенности модели или прогноза.",agent,ai-agents,confidence|meter|agent|ai-agents,индикатор|уверенности|агент|ИИ-агенты,confidence score|certainty gauge,оценка уверенности|шкала достоверности,,,chart,project-authored,https://github.com/kroffske/excalidraw-js,assets/PROVENANCE.md#project-authored-bundled-assets,MIT,https://github.com/kroffske/excalidraw-js/blob/d28d62eaa0f4c6b0ceb06af216f91ed5f4545bd7/LICENSE,Project-authored by repository owner and maintainer kroffske.,45ed976cbe3687656146ac803aa17cf6f777cfba64be1db235c76ffc84d34846
agents_brain_ai_01-32,agents,brain_ai,01-32,1,32,agents_brain_ai_01-32.svg,0 0 512 512,brain_ai,#0b1fb3,2,1,core,Brain AI,Мозг искусственного интеллекта,Brain motif representing artificial intelligence and reasoning.,"Образ мозга, обозначающий искусственный интеллект и рассуждение.",agent,ai-agents,brain|ai|agent|ai-agents,мозг|искусственного|интеллекта|агент|ИИ-агенты,artificial intelligence|machine reasoning,искусственный интеллект|машинное рассуждение,,,service,project-authored,https://github.com/kroffske/excalidraw-js,assets/PROVENANCE.md#project-authored-bundled-assets,MIT,https://github.com/kroffske/excalidraw-js/blob/d28d62eaa0f4c6b0ceb06af216f91ed5f4545bd7/LICENSE,Project-authored by repository owner and maintainer kroffske.,c65a2667d4b7a92d05f487212fcb23ac4968550287492c990ba60ce042ba729d
agents_chat_message_01-33,agents,chat_message,01-33,1,33,agents_chat_message_01-33.svg,0 0 512 512,chat_message,#0b1fb3,2,1,core,Chat Message,Сообщение чата,Single speech bubble representing a chat message.,"Одиночное речевое облако, обозначающее сообщение чата.",agent,ai-agents,chat|message|agent|ai-agents,сообщение|чата|агент|ИИ-агенты,conversation message|speech bubble,сообщение диалога|реплика чата,,,event,project-authored,https://github.com/kroffske/excalidraw-js,assets/PROVENANCE.md#project-authored-bundled-assets,MIT,https://github.com/kroffske/excalidraw-js/blob/d28d62eaa0f4c6b0ceb06af216f91ed5f4545bd7/LICENSE,Project-authored by repository owner and maintainer kroffske.,4cdcae66bf31b6526131cf72fb8146ea803212977da11dbd6c54c379d98f6ddb
data_api_connector_02-01,data,api_connector,02-01,2,1,data_api_connector_02-01.svg,0 0 512 512,api_connector,#0b1fb3,2,1,core,API Connector,Коннектор API,Connector linking a system to an application programming interface.,"Коннектор, связывающий систему с программным интерфейсом.",service,data,api|connector|service|data,коннектор|api|сервис|данные,API integration|service connector,интеграция API|подключение сервиса,,,service,project-authored,https://github.com/kroffske/excalidraw-js,assets/PROVENANCE.md#project-authored-bundled-assets,MIT,https://github.com/kroffske/excalidraw-js/blob/d28d62eaa0f4c6b0ceb06af216f91ed5f4545bd7/LICENSE,Project-authored by repository owner and maintainer kroffske.,73cff62d709cbbb8d6e751084bf5a29b601b7c44d4242a52543737ce5c753d23
data_server_stack_02-02,data,server_stack,02-02,2,2,data_server_stack_02-02.svg,0 0 512 512,server_stack,#0b1fb3,2,1,core,Server Stack,Стек серверов,Stack of server units representing compute infrastructure.,"Стопка серверных блоков, обозначающая вычислительную инфраструктуру.",service,data,server|stack|service|data,стек|серверов|сервис|данные,server infrastructure|compute stack,серверная инфраструктура|вычислительный стек,,,service,project-authored,https://github.com/kroffske/excalidraw-js,assets/PROVENANCE.md#project-authored-bundled-assets,MIT,https://github.com/kroffske/excalidraw-js/blob/d28d62eaa0f4c6b0ceb06af216f91ed5f4545bd7/LICENSE,Project-authored by repository owner and maintainer kroffske.,82e267d00b407f1a67d0164ca08d829596aa45b4b03eee227d549d7f668b779e
data_cloud_data_02-03,data,cloud_data,02-03,2,3,data_cloud_data_02-03.svg,0 0 512 512,cloud_data,#0b1fb3,2,1,core,Cloud Data,Облачные данные,Cloud containing or exchanging stored data.,"Облако, содержащее или передающее сохранённые данные.",service,data,cloud|data|service,облачные|данные|сервис,cloud storage|hosted data,облачное хранилище|данные в облаке,,,service,project-authored,https://github.com/kroffske/excalidraw-js,assets/PROVENANCE.md#project-authored-bundled-assets,MIT,https://github.com/kroffske/excalidraw-js/blob/d28d62eaa0f4c6b0ceb06af216f91ed5f4545bd7/LICENSE,Project-authored by repository owner and maintainer kroffske.,8c70fcb8dcd09f9dc0deb8e9422f387759b4e24e453c0a16703110dd52f0d8e4
data_streaming_data_02-04,data,streaming_data,02-04,2,4,data_streaming_data_02-04.svg,0 0 512 512,streaming_data,#0b1fb3,2,1,core,Streaming Data,Потоковые данные,Continuous sequence of data records moving through a system.,"Непрерывная последовательность записей данных, проходящая через систему.",pipeline,data,streaming|data|pipeline,потоковые|данные|конвейер,data stream|real-time data,поток данных|данные реального времени,,,data,project-authored,https://github.com/kroffske/excalidraw-js,assets/PROVENANCE.md#project-authored-bundled-assets,MIT,https://github.com/kroffske/excalidraw-js/blob/d28d62eaa0f4c6b0ceb06af216f91ed5f4545bd7/LICENSE,Project-authored by repository owner and maintainer kroffske.,9c9d2c3b2999697dff11f6e1a408395c58e1a4fc9ab908208104687b32fe7a31
data_data_lake_02-05,data,data_lake,02-05,2,5,data_data_lake_02-05.svg,0 0 512 512,data_lake,#8fb7df|#0b1fb3,2,1,core,Data Lake,Озеро данных,Lake-like data repository containing raw data blocks.,Похожее на озеро хранилище с блоками необработанных данных.,data,data,data|lake,озеро|данных|данные,raw data repository|lake storage,хранилище сырых данных|озёрное хранилище,,,data,project-authored,https://github.com/kroffske/excalidraw-js,assets/PROVENANCE.md#project-authored-bundled-assets,MIT,https://github.com/kroffske/excalidraw-js/blob/d28d62eaa0f4c6b0ceb06af216f91ed5f4545bd7/LICENSE,Project-authored by repository owner and maintainer kroffske.,ead218f21faa16e16bae46f2cb0b7e25d79d2f82664eaf1c989733b2da1b3783
data_data_warehouse_02-06,data,data_warehouse,02-06,2,6,data_data_warehouse_02-06.svg,0 0 512 512,data_warehouse,#8fb7df|#0b1fb3,2,1,core,Data Warehouse,Хранилище данных,Warehouse structure holding organized analytical data.,"Складская структура, содержащая организованные аналитические данные.",data,data,data|warehouse,хранилище|данных|данные,analytical warehouse|enterprise data store,аналитическое хранилище|корпоративное хранилище данных,,,data,project-authored,https://github.com/kroffske/excalidraw-js,assets/PROVENANCE.md#project-authored-bundled-assets,MIT,https://github.com/kroffske/excalidraw-js/blob/d28d62eaa0f4c6b0ceb06af216f91ed5f4545bd7/LICENSE,Project-authored by repository owner and maintainer kroffske.,d7bba1b55bcf3e9d05c4c819a7b61070168764b235cd81abe53a4172af0b3eda
data_etl_pipeline_dag_02-07,data,etl_pipeline_dag,02-07,2,7,data_etl_pipeline_dag_02-07.svg,0 0 512 512,etl_pipeline_dag,#8fb7df|#0b1fb3,2,1,core,ETL Pipeline DAG,Граф ETL-конвейера,"Directed pipeline of extract, transform, and load stages.","Направленный конвейер этапов извлечения, преобразования и загрузки.",pipeline,data,etl|pipeline|dag|data,граф|etl|конвейера|конвейер|данные,data transformation pipeline|ETL workflow,конвейер преобразования данных|процесс ETL,,,data,project-authored,https://github.com/kroffske/excalidraw-js,assets/PROVENANCE.md#project-authored-bundled-assets,MIT,https://github.com/kroffske/excalidraw-js/blob/d28d62eaa0f4c6b0ceb06af216f91ed5f4545bd7/LICENSE,Project-authored by repository owner and maintainer kroffske.,09ed699c7856eb9e0dcfafcd2867d114d1bf34fb79d7929c2a1ddc7daa9b7b5d
data_change_data_capture_02-08,data,change_data_capture,02-08,2,8,data_change_data_capture_02-08.svg,0 0 512 512,change_data_capture,#8fb7df|#0b1fb3,2,1,core,Change Data Capture,Захват изменений данных,Before-and-after data states connected by a change event.,"Состояния данных до и после, соединённые событием изменения.",pipeline,data,change|data|capture|pipeline,захват|изменений|данных|конвейер|данные,database change stream|CDC,поток изменений базы|отслеживание изменений,,,data,project-authored,https://github.com/kroffske/excalidraw-js,assets/PROVENANCE.md#project-authored-bundled-assets,MIT,https://github.com/kroffske/excalidraw-js/blob/d28d62eaa0f4c6b0ceb06af216f91ed5f4545bd7/LICENSE,Project-authored by repository owner and maintainer kroffske.,3fdc698f3f8526df713d7112f639548f457d62d2c0e0370d0b7c30c2079c78b5
data_schema_registry_02-09,data,schema_registry,02-09,2,9,data_schema_registry_02-09.svg,0 0 512 512,schema_registry,#8fb7df|#08741c|#0b1fb3,2,1,core,Schema Registry,Реестр схем,Registry document holding validated data schema definitions.,Документ реестра с проверенными определениями схем данных.,data,data,schema|registry|data,реестр|схем|данные,schema catalog|data contract registry,каталог схем|реестр контрактов данных,,,data,project-authored,https://github.com/kroffske/excalidraw-js,assets/PROVENANCE.md#project-authored-bundled-assets,MIT,https://github.com/kroffske/excalidraw-js/blob/d28d62eaa0f4c6b0ceb06af216f91ed5f4545bd7/LICENSE,Project-authored by repository owner and maintainer kroffske.,3fc58d287fb4f201985827f47492ff471fcdcd9eca02f96f720a76a842e915c4
data_data_catalog_02-10,data,data_catalog,02-10,2,10,data_data_catalog_02-10.svg,0 0 512 512,data_catalog,#8fb7df|#0b1fb3,2,1,core,Data Catalog,Каталог данных,Catalog or book organizing discoverable data sets.,"Каталог или книга, организующая доступные для поиска наборы данных.",data,data,data|catalog,каталог|данных|данные,dataset inventory|metadata catalog,реестр наборов данных|каталог метаданных,,,data,project-authored,https://github.com/kroffske/excalidraw-js,assets/PROVENANCE.md#project-authored-bundled-assets,MIT,https://github.com/kroffske/excalidraw-js/blob/d28d62eaa0f4c6b0ceb06af216f91ed5f4545bd7/LICENSE,Project-authored by repository owner and maintainer kroffske.,ed7debd8f5cde31160da2ff3b672d1956622898001d5ab84f9d7f87ceb8a4a6a
data_data_quality_check_02-11,data,data_quality_check,02-11,2,11,data_data_quality_check_02-11.svg,0 0 512 512,data_quality_check,#8fb7df|#08741c|#0b1fb3,2,1,core,Data Quality Check,Проверка качества данных,Data table with a check mark indicating validation.,"Таблица данных с галочкой, обозначающей проверку.",data,data,data|quality|check,проверка|качества|данных|данные,data validation|quality test,валидация данных|контроль качества,,,data,project-authored,https://github.com/kroffske/excalidraw-js,assets/PROVENANCE.md#project-authored-bundled-assets,MIT,https://github.com/kroffske/excalidraw-js/blob/d28d62eaa0f4c6b0ceb06af216f91ed5f4545bd7/LICENSE,Project-authored by repository owner and maintainer kroffske.,60af3e228306633153ba9e5dbb3680a570472a04542c488a0fa3480549f04bef
data_data_lineage_02-12,data,data_lineage,02-12,2,12,data_data_lineage_02-12.svg,0 0 512 512,data_lineage,#8fb7df|#0b1fb3,2,1,core,Data Lineage,Происхождение данных,Chain from source through transformation to data output.,Цепочка от источника через преобразование к результату данных.,pipeline,data,data|lineage|pipeline,происхождение|данных|конвейер|данные,data provenance|source transformation chain,трассировка данных|цепочка преобразований,,,data,project-authored,https://github.com/kroffske/excalidraw-js,assets/PROVENANCE.md#project-authored-bundled-assets,MIT,https://github.com/kroffske/excalidraw-js/blob/d28d62eaa0f4c6b0ceb06af216f91ed5f4545bd7/LICENSE,Project-authored by repository owner and maintainer kroffske.,c5204c47604e0310a3d2afb740e1283346cbd1a3512d755d22cb32439ff6ebd3
data_feature_store_02-13,data,feature_store,02-13,2,13,data_feature_store_02-13.svg,0 0 512 512,feature_store,#8fb7df|#0b1fb3,2,1,core,Feature Store,Хранилище признаков,Repository organizing reusable machine-learning features.,"Хранилище, организующее повторно используемые признаки машинного обучения.",data,data,feature|store|data,хранилище|признаков|данные,ML feature repository|feature platform,репозиторий признаков|платформа признаков,,,data,project-authored,https://github.com/kroffske/excalidraw-js,assets/PROVENANCE.md#project-authored-bundled-assets,MIT,https://github.com/kroffske/excalidraw-js/blob/d28d62eaa0f4c6b0ceb06af216f91ed5f4545bd7/LICENSE,Project-authored by repository owner and maintainer kroffske.,c9699494b74c62d529ab8683b6de98e3a702af5093fe58c8c05db2126fefd794
data_labeled_dataset_02-14,data,labeled_dataset,02-14,2,14,data_labeled_dataset_02-14.svg,0 0 512 512,labeled_dataset,#8fb7df|#0b1fb3,2,1,core,Labeled Dataset,Размеченный набор данных,Dataset records paired with training labels or tags.,"Записи набора данных, снабжённые обучающими метками или тегами.",data,data,labeled|dataset|data,размеченный|набор|данных|данные,annotated data|training dataset,аннотированные данные|обучающая выборка,,,data,project-authored,https://github.com/kroffske/excalidraw-js,assets/PROVENANCE.md#project-authored-bundled-assets,MIT,https://github.com/kroffske/excalidraw-js/blob/d28d62eaa0f4c6b0ceb06af216f91ed5f4545bd7/LICENSE,Project-authored by repository owner and maintainer kroffske.,c695a44e19aa93b307a89cd211d0c3bd0659eb97e893b27e5c10c883b0ce49e6
data_feature_engineering_02-15,data,feature_engineering,02-15,2,15,data_feature_engineering_02-15.svg,0 0 512 512,feature_engineering,#8fb7df|#0b1fb3,2,1,core,Feature Engineering,Конструирование признаков,Gears transforming raw columns into model features.,"Шестерёнки, преобразующие исходные столбцы в признаки модели.",pipeline,data,feature|engineering|pipeline|data,конструирование|признаков|конвейер|данные,feature transformation|feature creation,преобразование признаков|создание признаков,,,data,project-authored,https://github.com/kroffske/excalidraw-js,assets/PROVENANCE.md#project-authored-bundled-assets,MIT,https://github.com/kroffske/excalidraw-js/blob/d28d62eaa0f4c6b0ceb06af216f91ed5f4545bd7/LICENSE,Project-authored by repository owner and maintainer kroffske.,e0be8adeac6f192d13bd297aca3628bbb07b4a2a9df3bb97b75551ff1ec95b62
data_train_test_split_02-16,data,train_test_split,02-16,2,16,data_train_test_split_02-16.svg,0 0 512 512,train_test_split,#8fb7df|#0b1fb3,2,1,core,Train Test Split,Разделение на обучение и тест,One dataset divided into separate training and test portions.,Один набор данных разделён на обучающую и тестовую части.,pipeline,data,train|test|split|pipeline|data,разделение|на|обучение|и|тест|конвейер|данные,dataset partition|training test division,разбиение выборки|обучающая и тестовая части,,,data,project-authored,https://github.com/kroffske/excalidraw-js,assets/PROVENANCE.md#project-authored-bundled-assets,MIT,https://github.com/kroffske/excalidraw-js/blob/d28d62eaa0f4c6b0ceb06af216f91ed5f4545bd7/LICENSE,Project-authored by repository owner and maintainer kroffske.,bf24445ae2a3dc3541a9eebecc0dc6d1f8d6ede3acdb1bfe0cf05f5ab28d4ad5
data_hyperparameter_search_02-17,data,hyperparameter_search,02-17,2,17,data_hyperparameter_search_02-17.svg,0 0 512 512,hyperparameter_search,#8fb7df|#0b1fb3,2,1,core,Hyperparameter Search,Поиск гиперпараметров,Parameter grid inspected to find a strong model configuration.,Сетка параметров исследуется для поиска удачной конфигурации модели.,evaluation,machine-learning,hyperparameter|search|evaluation|machine-learning,поиск|гиперпараметров|оценка|машинное обучение,parameter search|model tuning,поиск параметров|настройка модели,,,chart,project-authored,https://github.com/kroffske/excalidraw-js,assets/PROVENANCE.md#project-authored-bundled-assets,MIT,https://github.com/kroffske/excalidraw-js/blob/d28d62eaa0f4c6b0ceb06af216f91ed5f4545bd7/LICENSE,Project-authored by repository owner and maintainer kroffske.,c395a7a545a2e2424bf4279343f2db544fb0f0396d72dec8879eece0bb7c30e0
data_model_registry_02-18,data,model_registry,02-18,2,18,data_model_registry_02-18.svg,0 0 512 512,model_registry,#8fb7df|#0b1fb3,2,1,core,Model Registry,Реестр моделей,Versioned model entries organized in a central registry.,"Версионированные модели, организованные в центральном реестре.",model,machine-learning,model|registry|machine-learning,реестр|моделей|модель|машинное обучение,model catalog|model version store,каталог моделей|хранилище версий моделей,,,data,project-authored,https://github.com/kroffske/excalidraw-js,assets/PROVENANCE.md#project-authored-bundled-assets,MIT,https://github.com/kroffske/excalidraw-js/blob/d28d62eaa0f4c6b0ceb06af216f91ed5f4545bd7/LICENSE,Project-authored by repository owner and maintainer kroffske.,2794763c8796f50ba0a83e97dd343b339931dc42b8e3ad67c3e253c4e7b7886a
data_feature_importance_02-19,data,feature_importance,02-19,2,19,data_feature_importance_02-19.svg,0 0 512 512,feature_importance,#8fb7df|#0b1fb3,2,1,core,Feature Importance,Важность признаков,Ranked bars showing how strongly features affect a model.,Ранжированные столбцы показывают влияние признаков на модель.,evaluation,machine-learning,feature|importance|evaluation|machine-learning,важность|признаков|оценка|машинное обучение,feature ranking|variable importance,ранжирование признаков|значимость переменных,,,chart,project-authored,https://github.com/kroffske/excalidraw-js,assets/PROVENANCE.md#project-authored-bundled-assets,MIT,https://github.com/kroffske/excalidraw-js/blob/d28d62eaa0f4c6b0ceb06af216f91ed5f4545bd7/LICENSE,Project-authored by repository owner and maintainer kroffske.,cc73cd29b1866565db4708f57eaef3f79851516862ba6f1acba5f389cfa4176d
